{
  "file": "transcript",
  "generator": "rand_core 0.10 ChaCha20Rng::seed_from_u64 (chacha20 =0.10.2)",
  "schema": "rizzy-vault/test-vectors/v1",
  "seed": "11",
  "spec": "CRYPTO.md §5, §11.1, §11.2, §11.3, §15 item 1 (B)",
  "tier": "B",
  "vectors": [
    {
      "id": "transcript/signup-login-unlock/0",
      "inputs": {
        "kdf_id": 1,
        "login_name": "Alice",
        "password": "correct horse battery staple",
        "seed": "15938107768195400442",
        "server_origin": "https://vault.example.com"
      },
      "kind": "transcript",
      "name": "signup-login-unlock",
      "outputs": {
        "account_id": "0776807cda3fab0ef640b47dd3cf9c3a",
        "account_key": "ec110432708820b48dc1e6b99fd2a6786a2544db5c891735572d102bbccf158d",
        "account_key_id": "013a64656041cf9e732cfef826722c7c",
        "context": "72697a7a792d7661756c742f76312f6f70617175652f636f6e7465787400000100010000001968747470733a2f2f7661756c742e6578616d706c652e636f6d",
        "device_id": "e492d8e126ee10c16bc1cc809794dd77",
        "device_salt": "ebeabf7c998ec870022ce12f1d97ed06",
        "e_local": "01012a61263cdd1ab788ece0806bac93f365d72e1997cd4f3d3cdcbe6facc11f7411121320d88c325b663d974ecb01a3567eec8dfd9ddfa6dafc3dc25cddf4713ca7788108a0935c1c78a7af5c16a0da5f352fa9d29895fd986a913a75cf8986df87aad506f46def6e15b6602803a64e8c8a25f9849f090ff783",
        "e_srv": "0101949b8b455eb68ad6f44600a3f0f8d1d30ea3481752f0c5e34cdd4006f8e0b694d18a410a03404182afb36ad128439348def1f62445ad99b4eae67f26bc7331d757a479fc76e3e892c5de08a42fc44bab8953ec5ed0b79532194ce56905886a4ebfcb5d9672cd6ba2da437d033a04f6d82ac40f524fa4697a",
        "export_key": "9ffa394591fb7f7394a960b5bfb27a548b15e863a69e4d9be4052c4be0cdfd2274e9bafcaad69f0f8e0ec9544db6c33d55011ce9a9870aef4e9140307c05d146",
        "ke1": "ac0d64178956f64ea8e8b8038ec5486e1117bc6738376e73e75397357f77d938e2572e2a99446d5180515fca5a30f6744163d69750f5da7283048b6d33ee1b7f86e7bd1f57d2ee9936a5f7e0694cc1a941793a8ee1a6204a203212e9dc2cda0e",
        "ke2": "967a81ab6b487870a040e2a5eb62b8cca176b1c27fafaff339bf764d091e533ce695bf905cf72448b2227cfa2bbcb637eeac57058e2228397d285c0450a46fe8e795ce2b38e18012c10468520a3e8d70a64d929fb906f532102db6aeec183abc67ca53dfbe8bc8c2ef9e31fe5a15d6797778ad5c1cf6f150c6a71bbe88959f8f3d7647b632e02eba2241aca790f2b9a27c6b2d33c291a0cb4d4a6bfc4a1f1026ed971a3eabc67b54ce8d5f47ace7231cdabb563635aa6fdd33ac8331ada3be79b7e44c7915a008fa44a1387d8481005ec3e52d9fc90fe70fb006a2089fb13336c090c8a271c6c0dfc7814b93ef33ce453b41eac52d38af47d0c92564c80b3e631c7a3d5d3b76130a4123de7c9d04c1ca25962452806638f919c08bac51cebedbcd789dfad4b245f6f8dd5b57fae87f1c4807bd18fdafe0ee97fc49c3bd1648ed",
        "ke3": "502a21658aad6128e872e01034f380ff20ed54040150f7484922ba4dcc104edc81d0fcdf9e40501a32d9b702f7a43a23e5dad030a022070c1bc5ff44110fc5ea",
        "local_unlock_key": "269d4f853283a12a08cdec1304b1d4d422d217bfc0ea3fa83027ec745e57b6bd",
        "password_file": "6a4ec7c0c6ab9baccb03806070b11d4a7f7d0d2b36b80b9ce3956398f7239274b92d5f257b678d7f4c0acfff167b080c74d2578a40e06a5e86e0bac13647a196c943138c342f2f2fc1becee48ce830dbc22627541d6b0bb93378a5f271a0dcf7be60dbb7f378fd5fff292c269f0602ba79735c72d5e8793b4df4c45106a89198025ca39fb18249146e1fc17ed67a8fc7644045c8d2737275989c12a4c508afde26910d57fb14c6738dd8af6c3aae35e294a93507e5d206a2afba871d81d33bd4",
        "pw_in": "55ff8ae11f9e1d8dacf197b4ff4a48bccea01f86eb1211f15200c32aa1a59ac9",
        "registration_request": "ba9cf0450dfd690c38fe6004e6ee073e58cc6755193e874f2a94049529ebb544",
        "registration_response": "1cc85d00c35ec70919ebe6b2e0e0085ae5bdb08df98cab4f31c78f99fbe35f47dedd4e11e593e5ccb651e65391e97b9000093476d555dd19ea7f1104432a3e0a",
        "registration_upload": "6a4ec7c0c6ab9baccb03806070b11d4a7f7d0d2b36b80b9ce3956398f7239274b92d5f257b678d7f4c0acfff167b080c74d2578a40e06a5e86e0bac13647a196c943138c342f2f2fc1becee48ce830dbc22627541d6b0bb93378a5f271a0dcf7be60dbb7f378fd5fff292c269f0602ba79735c72d5e8793b4df4c45106a89198025ca39fb18249146e1fc17ed67a8fc7644045c8d2737275989c12a4c508afde26910d57fb14c6738dd8af6c3aae35e294a93507e5d206a2afba871d81d33bd4",
        "secret_key": "9b48cb74e7a72ac429e08f417bff0978",
        "server_setup": "243fdffe0e47b30a75a2d47f33cc6f4ce1f35f37a5dbd91325515221c78a60a006de18285874c344521c44743da768bf8b03929af4c5b187c5a498c9a76389dff1f58023211a0b6364065d559d4664b10e407b680f9805cd6fb2354cd073e00e54b33da4cbcce64ed4a58e7337182e5f7b5e93584e547566d92a68c69af2bc0e",
        "server_unlock_key": "e38b1bdcc9d7647ffdcab568611af0063b2d19bb43fd2f89623a3454827b52a0"
      }
    }
  ]
}
